{
  "schema_version": 1,
  "node_id": "53494D0000000001",
  "source": "simulator",
  "session_id": "15f75ec4-29ab-48ab-93be-81d3e0708a68",
  "sequence": 128,
  "message_id": "53494D0000000001:15f75ec4-29ab-48ab-93be-81d3e0708a68:events:128",
  "observed_at": "2026-10-08T14:00:00.000Z",
  "published_at": "2026-10-08T14:00:00.000Z",
  "clock_source": "simulator_host",
  "event_id": "53494D0000000001:15f75ec4-29ab-48ab-93be-81d3e0708a68:events:128",
  "telemetry_message_id": "53494D0000000001:15f75ec4-29ab-48ab-93be-81d3e0708a68:telemetry:126",
  "kind": "observation_gap",
  "previous_error_flags": null,
  "current_error_flags": null,
  "faults": null,
  "added_faults": [],
  "cleared_faults": []
}
